[
  {
    "id": "vi-001",
    "clientId": "c1",
    "vendorId": "vd-013",
    "contractId": "vc-003",
    "severity": "high",
    "title": "Project milestone delay - Phase 2",
    "description": "Phase 2 delivery delayed by 3 weeks due to resource constraints.",
    "status": "resolved",
    "category": "sla_breach",
    "impactJson": {
      "financialImpact": 45000,
      "affectedServices": [
        "System Integration"
      ],
      "downtimeMinutes": 0,
      "reputationalRisk": "medium"
    },
    "rootCause": "Vendor resource reallocation to higher priority client",
    "resolution": "Additional resources assigned, delivery completed",
    "reportedAt": "2024-10-15T09:00:00Z",
    "resolvedAt": "2024-11-05T16:00:00Z",
    "assignedTo": "John Smith",
    "createdAt": "2024-10-15T09:00:00Z",
    "updatedAt": "2024-11-05T16:00:00Z"
  },
  {
    "id": "vi-002",
    "clientId": "c1",
    "vendorId": "vd-003",
    "severity": "low",
    "title": "Trade confirmation delay",
    "description": "Trade confirmations delayed by 4 hours.",
    "status": "closed",
    "category": "communication",
    "impactJson": {
      "financialImpact": 0,
      "affectedServices": [
        "Trade Execution"
      ],
      "downtimeMinutes": 240,
      "reputationalRisk": "low"
    },
    "rootCause": "Email gateway issue on vendor side",
    "resolution": "Gateway restarted, confirmations sent",
    "reportedAt": "2024-10-25T16:00:00Z",
    "resolvedAt": "2024-10-25T20:00:00Z",
    "assignedTo": "Trading Operations",
    "createdAt": "2024-10-25T16:00:00Z",
    "updatedAt": "2024-10-26T10:00:00Z"
  },
  {
    "id": "vi-003",
    "clientId": "c1",
    "vendorId": "vd-014",
    "severity": "critical",
    "title": "Cloud service outage",
    "description": "Brief service interruption affecting data access for 15 minutes.",
    "status": "closed",
    "category": "service_outage",
    "impactJson": {
      "financialImpact": 5000,
      "affectedServices": [
        "Cloud Infrastructure",
        "Data Access"
      ],
      "downtimeMinutes": 15,
      "reputationalRisk": "low"
    },
    "rootCause": "Regional AWS infrastructure issue",
    "resolution": "Automatic failover to secondary region",
    "reportedAt": "2024-09-10T14:30:00Z",
    "resolvedAt": "2024-09-10T14:45:00Z",
    "assignedTo": "IT Operations",
    "createdAt": "2024-09-10T14:30:00Z",
    "updatedAt": "2024-09-11T10:00:00Z"
  }
]